<?xml version='1.0' encoding='utf-8'?>
<!DOCTYPE list SYSTEM "zone.dtd">
<!--AUTHOR: Bonux-->
<list>
	<zone name="[InstantAgit_peace_zone1]" type="peace_zone">
		<set name="enabled" value="false"/>
		<polygon>
			<coords loc="-117545 -122814 -6120 -5620"/>
			<coords loc="-116462 -122825 -6120 -5620"/>
			<coords loc="-116460 -121354 -6120 -5620"/>
			<coords loc="-117542 -121343 -6120 -5620"/>
		</polygon>
	</zone>
	<zone name="[InstantAgit_peace_zone2]" type="peace_zone">
		<set name="enabled" value="false"/>
		<polygon>
			<coords loc="-122820 -122819 -5950 -5450"/>
			<coords loc="-121738 -122830 -5950 -5450"/>
			<coords loc="-121735 -121359 -5950 -5450"/>
			<coords loc="-122817 -121348 -5950 -5450"/>
		</polygon>
	</zone>
	<zone name="[InstantAgit_peace_zone3]" type="peace_zone">
		<set name="enabled" value="false"/>
		<polygon>
			<coords loc="-112262 -122818 -6120 -5620"/>
			<coords loc="-111180 -122829 -6120 -5620"/>
			<coords loc="-111177 -121358 -6120 -5620"/>
			<coords loc="-112259 -121347 -6120 -5620"/>
		</polygon>
	</zone>
	<zone name="[InstantAgit_peace_zone4]" type="peace_zone">
		<set name="enabled" value="false"/>
		<polygon>
			<coords loc="-117598 -117174 -6120 -5620"/>
			<coords loc="-115754 -117188 -6120 -5620"/>
			<coords loc="-115753 -115924 -6120 -5620"/>
			<coords loc="-117600 -115926 -6120 -5620"/>
		</polygon>
	</zone>
	<zone name="[InstantAgit_peace_zone5]" type="peace_zone">
		<set name="enabled" value="false"/>
		<polygon>
			<coords loc="-122770 -117171 -6120 -5620"/>
			<coords loc="-120927 -117186 -6120 -5620"/>
			<coords loc="-120926 -115921 -6120 -5620"/>
			<coords loc="-122772 -115923 -6120 -5620"/>
		</polygon>
	</zone>
	<zone name="[InstantAgit_peace_zone6]" type="peace_zone">
		<set name="enabled" value="false"/>
		<polygon>
			<coords loc="-112290 -117174 -6120 -5620"/>
			<coords loc="-110447 -117188 -6120 -5620"/>
			<coords loc="-110446 -115924 -6120 -5620"/>
			<coords loc="-112293 -115926 -6120 -5620"/>
		</polygon>
	</zone>
	<zone name="[InstantAgit_peace_zone7]" type="peace_zone">
		<set name="enabled" value="false"/>
		<polygon>
			<coords loc="-117620 -111833 -6120 -5620"/>
			<coords loc="-116081 -111833 -6120 -5620"/>
			<coords loc="-116066 -110661 -6120 -5620"/>
			<coords loc="-117620 -110663 -6120 -5620"/>
		</polygon>
	</zone>
	<zone name="[InstantAgit_peace_zone8]" type="peace_zone">
		<set name="enabled" value="false"/>
		<polygon>
			<coords loc="-122847 -111833 -6120 -5620"/>
			<coords loc="-121308 -111833 -6120 -5620"/>
			<coords loc="-121293 -110661 -6120 -5620"/>
			<coords loc="-122847 -110663 -6120 -5620"/>
		</polygon>
	</zone>
	<zone name="[InstantAgit_peace_zone9]" type="peace_zone">
		<set name="enabled" value="false"/>
		<polygon>
			<coords loc="-112273 -111833 -6120 -5620"/>
			<coords loc="-110734 -111833 -6120 -5620"/>
			<coords loc="-110718 -110660 -6120 -5620"/>
			<coords loc="-112272 -110663 -6120 -5620"/>
		</polygon>
	</zone>
</list>