<?xml version='1.0' encoding='utf-8'?>
<!DOCTYPE list SYSTEM "zone.dtd">
<list>
	<zone name="[baium_epic]" type="epic" >
		<polygon>
			<coords loc="116616 17576 10032 10232"/>
			<coords loc="117064 16552 10032 10232"/>
			<coords loc="117032 15592 10032 10232"/>
			<coords loc="116664 14632 10032 10232"/>
			<coords loc="116024 14008 10032 10232"/>
			<coords loc="115128 13640 10032 10232"/>
			<coords loc="114136 13624 10032 10232"/>
			<coords loc="113256 13992 10032 10232"/>
			<coords loc="112568 14664 10032 10232"/>
			<coords loc="112216 15592 10032 10232"/>
			<coords loc="112216 16552 10032 10232"/>
			<coords loc="112600 17432 10032 10232"/>
			<coords loc="113288 18120 10032 10232"/>
			<coords loc="114152 18472 10032 10232"/>
			<coords loc="115144 18488 10032 10232"/>
			<coords loc="116152 18024 10032 10232"/>
		</polygon>
	</zone>
	<zone name="[antharas_epic]" type="epic" >
		<polygon>
			<coords loc="181552 116384 -7704 -7604"/>
			<coords loc="179849 118366 -7704 -7604"/>
			<coords loc="175896 118465 -7704 -7604"/>

			<coords loc="175320 118088 -7704 -7604"/>
			<coords loc="173816 115656 -7704 -7604"/>
			<coords loc="173720 114120 -7704 -7604"/>
			<coords loc="175160 111848 -7704 -7604"/>
			<coords loc="175704 111304 -7704 -7604"/>
			<coords loc="176408 111192 -7704 -7604"/>
			<coords loc="179432 111192 -7704 -7604"/>
			<coords loc="179832 111320 -7704 -7604"/>
			<coords loc="180072 111592 -7704 -7604"/>

			<!-- <coords loc="175328 118128 -7704 -7604"/>
			<coords loc="173728 115536 -7704 -7604"/>
			<coords loc="173609 114700 -7704 -7604"/>
			<coords loc="173712 114128 -7704 -7604"/>
			<coords loc="175385 111503 -7704 -7604"/>
			<coords loc="176016 111216 -7704 -7604"/>
			<coords loc="179896 111348 -7704 -7604"/>
			<coords loc="180730 112225 -7704 -7604"/> -->

			<coords loc="182199 114122 -7728 -7628"/>
			<coords loc="184369 114148 -8216 -8116"/>
			<coords loc="186526 113634 -8216 -8116"/>
			<coords loc="187279 114909 -8216 -8116"/>
			<coords loc="186627 115882 -8216 -8116"/>
			<coords loc="184224 115472 -8208 -8108"/>
			<coords loc="182272 115584 -7744 -7644"/>
		</polygon>
	</zone>
	<zone name="[antharas_cave]" type="epic">
		<set name="enabled" value="true"/>
		<polygon>
			<coords loc="126552 120312 -5000 -2000"/>
			<coords loc="128472 121496 -5000 -2000"/>
			<coords loc="129544 122328 -5000 -2000"/>
			<coords loc="129960 123592 -5000 -2000"/>
			<coords loc="127368 127432 -5000 -2000"/>
			<coords loc="125224 127032 -5000 -2000"/>
			<coords loc="125176 127000 -5000 -2000"/>
			<coords loc="121944 123928 -5000 -2000"/>
			<coords loc="122120 122344 -5000 -2000"/>
			<coords loc="125352 120360 -5000 -2000"/>
		</polygon>
	</zone>
	<zone name="[queen_ant_epic]" type="epic" >
		<set name="levelLimit" value="48"/>
		<set name="tele" value="-25464 172424 -4203"/>
		<polygon>
			<coords loc="-23176 185080 -6000 -5500"/>
			<coords loc="-20104 185080 -6000 -5500"/>
			<coords loc="-20104 177928 -6000 -5500"/>
			<coords loc="-23176 177928 -6000 -5500"/>
		</polygon>
	</zone>
</list>